[
  {
    "agp": 1,
    "plane": "control",
    "type": "open",
    "id": "open-1",
    "body": {
      "nodeId": "node.alpha",
      "sessionId": "a0b1c2",
      "holdTimeMs": 9000,
      "receiveLimitBytes": 131072,
      "maxRoutesPerSnapshot": 16,
      "maxPathLength": 8,
      "maxDataHopLimit": 16,
      "transit": true
    }
  },
  {
    "agp": 1,
    "plane": "control",
    "type": "keepalive",
    "id": "keepalive-1",
    "body": {}
  },
  {
    "agp": 1,
    "plane": "control",
    "type": "route.update",
    "id": "routes-1",
    "body": {
      "revision": 1,
      "routes": [
        {
          "endpoint": "demo/client",
          "originNodeId": "node.alpha",
          "path": ["node.alpha"]
        },
        {
          "endpoint": "demo/service",
          "originNodeId": "node.alpha",
          "path": ["node.alpha"]
        }
      ]
    }
  },
  {
    "agp": 1,
    "plane": "control",
    "type": "route.ack",
    "id": "routes-ack-1",
    "body": {
      "refId": "routes-1",
      "revision": 1,
      "rejected": [
        {
          "endpoint": "demo/service",
          "originNodeId": "node.alpha",
          "reasonCode": "POLICY"
        }
      ]
    }
  },
  {
    "agp": 1,
    "plane": "control",
    "type": "notification",
    "id": "notification-1",
    "body": {
      "code": "CEASE",
      "reason": "administrative stop"
    }
  },
  {
    "agp": 1,
    "plane": "control",
    "type": "disposition",
    "id": "disposition-1",
    "body": {
      "delivered": [
        {
          "from": "0000000000000001",
          "to": "000000000000000a"
        },
        {
          "from": "000000000000000c",
          "to": "000000000000000c",
          "destinations": 3
        }
      ],
      "unknown": [
        {
          "from": "000000000000000d",
          "to": "000000000000000e"
        }
      ],
      "failed": [
        {
          "code": "NO_ROUTE",
          "refId": "data-1",
          "returnToken": "000000000000000b",
          "failedAtNodeId": "node.beta",
          "reason": "no selected route"
        }
      ]
    }
  },
  {
    "agp": 1,
    "plane": "data",
    "type": "message",
    "id": "data-1",
    "body": {
      "source": {
        "endpoint": "demo/client",
        "originNodeId": "node.alpha"
      },
      "destination": "demo/service",
      "correlationId": "request-1",
      "returnToken": "0000000000000000",
      "hopLimit": 8,
      "payload": {
        "operation": "ping",
        "sequence": 1
      }
    },
    "extensions": {
      "example.trace": {
        "sampled": true
      }
    }
  }
]
